{
  "$schema": "../start/product-increment-portfolio.schema.json",
  "schema": "appfw_product_increment_portfolio@1",
  "portfolio_id": "app-framework-and-nexus",
  "title": "App Framework and Nexus Product Increment portfolio",
  "last_reconciled_at": "2026-08-04T22:51:50Z",
  "catalog_state": "migration_required",
  "operating_capacity": {
    "target_active_lanes": 3,
    "maximum_active_lanes": 4,
    "current_active_lanes": 1,
    "current_review_lanes": 0,
    "below_target_reason": "The delivery-control correction Delivery Lane remains the sole counted active Delivery Lane. AF-M01.4 has one separately admitted Integration lane under PFC Assignment comment 835555085 and Amendment r2 comment 835556572; M0-02 remains ready but not WIP-admitted. Nexus lanes still wait for the delivery-control contract to be accepted, and existing PDS Experience System work still needs one canonical increment plan."
  },
  "economics_control": {
    "context_capsule_max_controlling_records": 4,
    "default_max_delegation_depth": 1,
    "correction_cycles_before_replan": 2,
    "idle_agent_policy": "unload",
    "model_routing_policy": "lowest_capable_then_escalate",
    "evidence_measurement_required": true,
    "primary_metrics": [
      "accepted_lead_time",
      "cost_per_accepted_deliverable",
      "tokens_per_accepted_deliverable",
      "review_queue_age",
      "rework_rate"
    ]
  },
  "product_increments": [
    {
      "id": "NXP-PI-ADD-PROVIDER-01",
      "outcome_id": "NXP-ADD-PROVIDER",
      "title": "Connected Add Provider proof",
      "plain_language_summary": "Prove one polished end-to-end Nexus journey across responsive web, native mobile, ServiceNow case state, a governed Workday change, and grounded assistance.",
      "owner": "Nexus Product Owner",
      "lifecycle_state": "blocked",
      "stage": "prototype",
      "status_updated_at": "2026-07-23T15:33:10Z",
      "current_status": "The four independent lanes and their fixture seams are defined. Source admission is held until the executable delivery-control contract is accepted; no implementation or acceptance credit is claimed.",
      "next_action": "Admit two or three disjoint lanes after the delivery-model change is accepted, beginning with experience, ServiceNow projection, and Workday contract work.",
      "plan_ref": "nexus-add-provider.product-increment.json",
      "integration_strategy": "integration_branch",
      "routing": {
        "current_maturity": "manual_explicit",
        "minimum_maturity": "manual_explicit",
        "fallback": "Use a human-approved route and named independent reviewer until transparent routing is accepted."
      },
      "provides": [
        {
          "capability_id": "nexus.add-provider.experience",
          "summary": "The integrated web and native user journey.",
          "state": "planned"
        },
        {
          "capability_id": "nexus.add-provider.connected-proof",
          "summary": "A coherent web and mobile proof of the Add Provider journey across enterprise boundaries.",
          "state": "planned"
        },
        {
          "capability_id": "servicenow.case-projection",
          "summary": "Typed authoritative case and task state for Nexus.",
          "state": "planned"
        },
        {
          "capability_id": "workday.add-provider-location",
          "summary": "Governed preview and execution of the named Workday operation.",
          "state": "planned"
        },
        {
          "capability_id": "intelligence.grounded-assistance",
          "summary": "Provider-neutral grounded explanation and recommendation metadata.",
          "state": "planned"
        }
      ],
      "requires": [
        {
          "from_product_increment_id": "AFS-PI-DELIVERY-CONTROL-01",
          "capability_id": "harness.product-increment-delivery-control",
          "required_state": "accepted",
          "reason": "Nexus parallel source admission needs the accepted lane, dependency, integration, and stage-rigor control rather than another conversational queue.",
          "decoupling": "none"
        }
      ],
      "benefits_from": [
        {
          "from_product_increment_id": "AFS-PI-P1",
          "capability_id": "harness.transparent-routing",
          "expected_benefit": "Nexus delivery can use cheaper bounded workers where appropriate while keeping route choice, review independence, and outcome economics visible.",
          "adoption_trigger": "AFS-PI-P1 reaches accepted and the five-task canary shows no quality regression."
        },
        {
          "from_product_increment_id": "AFS-PI-FAST-LANES-01",
          "capability_id": "harness.operational-parallel-lanes",
          "expected_benefit": "Two to four Nexus lanes can progress on separate workstations without duplicate source ownership or repeating main-level CI on every leaf branch.",
          "adoption_trigger": "The shared lease adapter and destination-aware accelerated CI profile are implemented and independently proven."
        }
      ],
      "evidence": [
        {
          "kind": "document",
          "ref": "docs/specs/nexus-add-provider.product-increment.json",
          "summary": "Executable four-lane Product Increment plan with cross-lane contracts and integration checks."
        }
      ]
    },
    {
      "id": "AFS-PI-DELIVERY-CONTROL-01",
      "outcome_id": "AFS-OUTCOME-DELIVERY-FLOW",
      "title": "Executable Product Increment delivery control",
      "plain_language_summary": "Give humans and agents one current, queryable operating system for major batches, parallel lanes, dependencies, integration branches, proof depth, and accepted progress.",
      "owner": "Program Product Manager",
      "lifecycle_state": "active",
      "stage": "prototype",
      "status_updated_at": "2026-07-28T01:57:15Z",
      "current_status": "The operating contract was merged through PR #445 but remains unaccepted. PR #454 pipeline #349 exposed a correction within that same increment: the 317-path changed-surface selector spent 39.800 seconds spawning per-path classifiers while its 71 documentation examples passed in 5.648 seconds. One active correction lane now batches classification without raising the 20 second fast budget, preserves fail-closed routing, and carries no delivery credit. The prior merged commit remains historical evidence; this branch does not claim live multi-workstation operation, Implemented credit, Accepted credit, or release readiness.",
      "next_action": "Complete exact-branch plan validation, representative 317-path timing proof, full framework evidence, comprehensive independent review, and the pre-push guard. If eligible, open a correction PR; after human merge and exact-main CI success, rerun PR #454 to prove its unchanged source SHA in the fast lane.",
      "plan_ref": "afs-product-increment-delivery-control.product-increment.json",
      "integration_strategy": "direct_main",
      "routing": {
        "current_maturity": "manual_explicit",
        "minimum_maturity": "manual_explicit",
        "fallback": "Use explicit human-approved assignments and named independent review; the unaccepted router is optional."
      },
      "provides": [
        {
          "capability_id": "harness.product-increment-delivery-control",
          "summary": "Executable portfolio, lane, dependency, router-maturity, integration, and delivery-credit governance.",
          "state": "planned"
        }
      ],
      "requires": [],
      "benefits_from": [],
      "evidence": [
        {
          "kind": "git",
          "ref": "9d470fdf14edf19f4b8e0fa779cf3078284a051d",
          "summary": "Delivery-control increment work, merged to main via PR #445 (durable commit; source branch closed on merge)."
        },
        {
          "kind": "document",
          "ref": "docs/specs/afs-product-increment-delivery-control.product-increment.json",
          "summary": "The current Product Increment contract owns its status, proof obligations, exact write scope, and next acceptance boundary; transient review history is not treated as delivery evidence."
        }
      ]
    },
    {
      "id": "AFS-PI-FAST-LANES-01",
      "outcome_id": "AFS-OUTCOME-DELIVERY-FLOW",
      "title": "Operational parallel delivery lanes",
      "plain_language_summary": "Turn the Product Increment model into a genuinely fast multi-workstation loop with one shared live source lease and destination- and risk-aware CI.",
      "owner": "Program Product Manager",
      "lifecycle_state": "planned",
      "stage": "prototype",
      "status_updated_at": "2026-07-23T20:59:00Z",
      "current_status": "The governing contract and local readiness checks are being completed. This capability is not operational yet: the current Bitbucket pipeline still runs main-level proof on leaf PRs, source exclusivity still depends on external Program Flow coordination, durable authority has no trusted Bitbucket receipt verifier, and dispatch has no trusted usage meter that can stop spend at the assigned budget.",
      "next_action": "Immediately after the delivery-control increment is accepted, activate two disjoint lanes: one for shared live leases plus trusted authority and metering adapters with runtime budget enforcement, and one for destination-aware accelerated CI. Prove duplicate-writer rejection, rejection of self-authored credit, pre-dispatch and runtime spend control, a fast leaf pipeline, and one-time aggregate proof.",
      "integration_strategy": "not_yet_planned",
      "routing": {
        "current_maturity": "manual_explicit",
        "minimum_maturity": "manual_explicit",
        "fallback": "Continue with one explicitly human-directed source lane and focused local proof; do not claim multi-workstation source authority or accelerated remote CI."
      },
      "provides": [
        {
          "capability_id": "harness.operational-parallel-lanes",